{
  "schema_version": "1.0.0",
  "evidence_id": "TDD-G3-OFFERS-LOAD",
  "requirement_ids": ["REQ-G3-OFFERS-LOAD", "REQ-G3-SHORTFALL-MAPPING"],
  "production_paths": ["src/pyspd/preprocess/offers.py", "src/pyspd/preprocess/shortfall.py"],
  "parent_commit": "a9cb72806e24a043673807d4d5619d50aef5aab4",
  "implementation_commit": "7ec923fe02ba51a1cd260cc641aeecbd01602af7",
  "test_patch_sha256": "88324e1214403cd05a6482b46511830cfc25b4cf6c8b8660a5de9191c509c151",
  "test_files": [
    {"path": "tests/preprocess/test_offers_load.py", "sha256": "fdbafcf9c01ca86a6b49820a391c928b7fefe7d163bc31cd39069821dfdd8c65"},
    {"path": "tests/preprocess/test_shortfall_mapping.py", "sha256": "dbf9b8151f7ccb1a90a6c569586fd57f81eaa9aed54c199d503007ba41953e41"}
  ],
  "command": "uv run pytest tests/preprocess -q",
  "package_manager": "uv",
  "environment_manifest_sha256": "f1a56598495c7339a0cc0b060a83e15fff5b163558fc2df935c4d646ad889b0d",
  "red": {"timestamp": "2026-08-29T15:00:00+12:00", "exit_code": 1, "output_sha256": "cd62fa271a2fde51d1e467ef8a0992a112267ffe561229419665b8e4db5d7eed", "duration_seconds": 0.10, "expected_failure_fingerprint": "REQ-G3-OFFERS-LOAD: offer, bid, and load preprocessing is absent", "log_uri": "docs/gate-3/tdd/logs/preprocess-red.log"},
  "green": {"timestamp": "2026-08-29T15:06:00+12:00", "exit_code": 0, "output_sha256": "bc9c36acc5440fa547b9b2fd206e3e4cb73647d02e5cd87189c7bb632811b6e2", "duration_seconds": 0.40, "log_uri": "docs/gate-3/tdd/logs/preprocess-green.log"},
  "author": {"name": "Codex", "role": "implementation agent"},
  "reviewer": {"name": "Codex", "role": "project-directed validator"},
  "exception": null
}
