{
  "schema_version": "1.0.0",
  "evidence_id": "TDD-G3-EVIDENCE",
  "requirement_ids": ["REQ-G3-ORACLE-PARITY", "REQ-G3-CORPUS"],
  "production_paths": ["tools/gate3/__init__.py", "tools/gate3/corpus.py", "tools/gate3/oracle_parity.py"],
  "parent_commit": "a9cb72806e24a043673807d4d5619d50aef5aab4",
  "implementation_commit": "7ec923fe02ba51a1cd260cc641aeecbd01602af7",
  "test_patch_sha256": "1b39ae7a2bfc00b5802fd301d3f4b299d60d47a3ef56182bc6f24877536336a7",
  "test_files": [{"path": "tests/preprocess/test_gate3_evidence.py", "sha256": "59b22fbbd339568dff55c665e71daed8ea4370e1e2eaf5b44a5f09373b5a594d"}],
  "command": "uv run pytest tests/preprocess -q",
  "package_manager": "uv",
  "environment_manifest_sha256": "f1a56598495c7339a0cc0b060a83e15fff5b163558fc2df935c4d646ad889b0d",
  "red": {"timestamp": "2026-08-29T15:00:00+12:00", "exit_code": 1, "output_sha256": "cd62fa271a2fde51d1e467ef8a0992a112267ffe561229419665b8e4db5d7eed", "duration_seconds": 0.10, "expected_failure_fingerprint": "REQ-G3-EVIDENCE: oracle and corpus qualification evidence are absent", "log_uri": "docs/gate-3/tdd/logs/preprocess-red.log"},
  "green": {"timestamp": "2026-08-29T15:06:00+12:00", "exit_code": 0, "output_sha256": "bc9c36acc5440fa547b9b2fd206e3e4cb73647d02e5cd87189c7bb632811b6e2", "duration_seconds": 0.40, "log_uri": "docs/gate-3/tdd/logs/preprocess-green.log"},
  "author": {"name": "Codex", "role": "implementation agent"},
  "reviewer": {"name": "Codex", "role": "project-directed validator"},
  "exception": null
}
