{
  "schema_version":"1.0.0","evidence_id":"TDD-G2-SCHEMA","requirement_ids":["REQ-G2-SCHEMA"],
  "production_paths":["src/pyspd/data/catalog.py","src/pyspd/data/catalogs/vspd-v5.0.6.json"],"parent_commit":"c10c522aa8dd7dbcf1e78f6955b15423d6d3ffa0","implementation_commit":"a395fb4482f7d977ab3e8515fe42d2b5551c9a21",
  "test_patch_sha256":"cb68ecdc585af91c8389f51b543be1603b15bfb95f3c0bddd7d0ddbf8bf1a1ee","test_files":[{"path":"tests/data/test_symbol_catalog.py","sha256":"d85acd58d2e9afbb114a9a7a63f90647fdd4854d2c8f2a1325814da42d957a01"}],
  "command":"uv run pytest tests/data/test_symbol_catalog.py -q -x","package_manager":"uv","environment_manifest_sha256":"34c1c38cdee1b6986088d2e8550e312e59c586a8278248749dc5331ed947279d",
  "red":{"timestamp":"2026-08-29T10:50:00+12:00","exit_code":1,"output_sha256":"1043ba6481c2402f6293c7b6c7fe7b49030b2fb510fb36bfb7d22820c70a8bc5","duration_seconds":0.307882834,"expected_failure_fingerprint":"REQ-G2-SCHEMA: source catalog validation is absent","log_uri":"docs/gate-2/tdd/logs/catalog-red.log"},
  "green":{"timestamp":"2026-08-29T11:12:00+12:00","exit_code":0,"output_sha256":"6cc6aaa4ff8a632915934766b8ffae3d2f1aed8736956d7c2984926cc3243e81","duration_seconds":0.730109875,"log_uri":"docs/gate-2/tdd/logs/catalog-green.log"},
  "author":{"name":"Codex","role":"implementation agent"},"reviewer":{"name":"Codex","role":"project-directed validator"},"exception":null
}
