{
  "schema_version":"1.0.0","evidence_id":"TDD-G2-PACKAGE","requirement_ids":["REQ-G2-PACKAGE"],
  "production_paths":["src/pyspd/__init__.py"],"parent_commit":"c10c522aa8dd7dbcf1e78f6955b15423d6d3ffa0","implementation_commit":"a395fb4482f7d977ab3e8515fe42d2b5551c9a21",
  "test_patch_sha256":"98e45055f62a43efcdeeb3a2c7600268c25901ddca8e03295242d8e8f24f3c9e","test_files":[{"path":"tests/package/test_import.py","sha256":"3ac39f18322a1511b5b68d90903a179057942a19282315a2e9f7ee34a7cfe1e6"}],
  "command":"uv run pytest tests/package/test_import.py -q","package_manager":"uv","environment_manifest_sha256":"34c1c38cdee1b6986088d2e8550e312e59c586a8278248749dc5331ed947279d",
  "red":{"timestamp":"2026-08-29T10:30:00+12:00","exit_code":1,"output_sha256":"1de8c717cdc599c509c410f760b67a55d056a4aac8016ce9e6a7e693e1532af3","duration_seconds":0.191213625,"expected_failure_fingerprint":"REQ-G2-PACKAGE: the pyspd src package is not importable","log_uri":"docs/gate-2/tdd/logs/package-red.log"},
  "green":{"timestamp":"2026-08-29T11:10:00+12:00","exit_code":0,"output_sha256":"09229b326b028651d725fa47cd1bae9fd8e0145ff8779bdb84ae2762c00ab737","duration_seconds":0.17118125,"log_uri":"docs/gate-2/tdd/logs/package-green.log"},
  "author":{"name":"Codex","role":"implementation agent"},"reviewer":{"name":"Codex","role":"project-directed validator"},"exception":null
}
