{
  "schema_version":"1.0.0","evidence_id":"TDD-G2-CANONICAL","requirement_ids":["REQ-G2-CANONICAL"],
  "production_paths":["src/pyspd/data/canonical.py","src/pyspd/data/raw.py","src/pyspd/data/values.py"],"parent_commit":"c10c522aa8dd7dbcf1e78f6955b15423d6d3ffa0","implementation_commit":"a395fb4482f7d977ab3e8515fe42d2b5551c9a21",
  "test_patch_sha256":"fce929c82c02931576fa59eefac583b188538e13cb2d46fde7d9cea141869153","test_files":[{"path":"tests/data/test_canonical_roundtrip.py","sha256":"0a9060d257175a07c39c92b126d58dd0711de1d24ce97abf6599508a0071eb57"}],
  "command":"uv run pytest tests/data/test_canonical_roundtrip.py -q -x","package_manager":"uv","environment_manifest_sha256":"34c1c38cdee1b6986088d2e8550e312e59c586a8278248749dc5331ed947279d",
  "red":{"timestamp":"2026-08-29T10:35:00+12:00","exit_code":1,"output_sha256":"e7fce988b9162b2ed22511f5462ada96566ea24975800380415ffda2d96f508a","duration_seconds":0.277923584,"expected_failure_fingerprint":"REQ-G2-CANONICAL: archive writing is not implemented","log_uri":"docs/gate-2/tdd/logs/canonical-red.log"},
  "green":{"timestamp":"2026-08-29T11:12:00+12:00","exit_code":0,"output_sha256":"d6f14c74feec45c9b9ddd61e7d88caaf397d533aaf819bf07ee530e3523f29d8","duration_seconds":1.35270425,"log_uri":"docs/gate-2/tdd/logs/canonical-green.log"},
  "author":{"name":"Codex","role":"implementation agent"},"reviewer":{"name":"Codex","role":"project-directed validator"},"exception":null
}
